{
  "edges": [
    {
      "confidence": 0.5,
      "relation": "related_to",
      "source": "arxiv:2607.09553v1",
      "target": "llm_agent"
    },
    {
      "confidence": 0.5,
      "relation": "related_to",
      "source": "arxiv:2607.09626v1",
      "target": "architecture"
    },
    {
      "confidence": 0.5,
      "relation": "related_to",
      "source": "arxiv:2607.09628v1",
      "target": "cognition"
    },
    {
      "confidence": 0.5,
      "relation": "related_to",
      "source": "arxiv:2607.09628v1",
      "target": "cognition_social"
    },
    {
      "confidence": 0.5,
      "relation": "related_to",
      "source": "arxiv:2607.09657v1",
      "target": "gpu_graphics"
    },
    {
      "confidence": 0.5,
      "relation": "related_to",
      "source": "arxiv:2607.09657v1",
      "target": "llm_agent"
    },
    {
      "confidence": 0.5,
      "relation": "related_to",
      "source": "arxiv:2607.09661v1",
      "target": "gpu_graphics"
    },
    {
      "confidence": 0.5,
      "relation": "related_to",
      "source": "arxiv:2607.09662v1",
      "target": "cognition"
    },
    {
      "confidence": 0.5,
      "relation": "related_to",
      "source": "arxiv:2607.09662v1",
      "target": "llm_agent"
    },
    {
      "confidence": 0.5,
      "relation": "related_to",
      "source": "arxiv:2607.11512v1",
      "target": "cognition"
    },
    {
      "confidence": 0.5,
      "relation": "related_to",
      "source": "arxiv:2607.11512v1",
      "target": "llm_agent"
    },
    {
      "confidence": 0.5,
      "relation": "related_to",
      "source": "arxiv:2607.11512v1",
      "target": "gpu_graphics"
    },
    {
      "confidence": 0.5,
      "relation": "related_to",
      "source": "arxiv:2607.11512v1",
      "target": "cognition_social"
    },
    {
      "confidence": 0.5,
      "relation": "related_to",
      "source": "arxiv:2607.11734v1",
      "target": "gpu_graphics"
    },
    {
      "confidence": 0.5,
      "relation": "related_to",
      "source": "arxiv:2607.11734v1",
      "target": "llm_agent"
    },
    {
      "confidence": 0.5,
      "relation": "related_to",
      "source": "arxiv:2607.11771v1",
      "target": "llm_agent"
    },
    {
      "confidence": 0.5,
      "relation": "related_to",
      "source": "arxiv:2607.11811v1",
      "target": "llm_agent"
    },
    {
      "confidence": 0.5,
      "relation": "related_to",
      "source": "arxiv:2607.11859v1",
      "target": "architecture"
    },
    {
      "confidence": 0.5,
      "relation": "related_to",
      "source": "arxiv:2607.11885v1",
      "target": "gpu_graphics"
    },
    {
      "confidence": 0.5,
      "relation": "related_to",
      "source": "arxiv:2607.12978v1",
      "target": "cognition"
    },
    {
      "confidence": 0.5,
      "relation": "related_to",
      "source": "arxiv:2607.12978v1",
      "target": "cognition_social"
    },
    {
      "confidence": 0.5,
      "relation": "related_to",
      "source": "arxiv:2607.13015v1",
      "target": "architecture"
    },
    {
      "confidence": 0.5,
      "relation": "related_to",
      "source": "arxiv:2607.13017v1",
      "target": "gpu_graphics"
    },
    {
      "confidence": 0.5,
      "relation": "related_to",
      "source": "arxiv:2607.13021v1",
      "target": "llm_agent"
    },
    {
      "confidence": 0.5,
      "relation": "related_to",
      "source": "arxiv:2607.13031v1",
      "target": "llm_agent"
    },
    {
      "confidence": 0.5,
      "relation": "related_to",
      "source": "arxiv:2607.13031v1",
      "target": "gpu_graphics"
    },
    {
      "confidence": 0.5,
      "relation": "related_to",
      "source": "arxiv:2607.13034v1",
      "target": "llm_agent"
    },
    {
      "confidence": 0.5,
      "relation": "related_to",
      "source": "arxiv:2607.14008v1",
      "target": "llm_agent"
    },
    {
      "confidence": 0.5,
      "relation": "related_to",
      "source": "arxiv:2607.14008v1",
      "target": "architecture"
    },
    {
      "confidence": 0.5,
      "relation": "related_to",
      "source": "arxiv:2607.14037v1",
      "target": "llm_agent"
    },
    {
      "confidence": 0.5,
      "relation": "related_to",
      "source": "arxiv:2607.14075v1",
      "target": "llm_agent"
    },
    {
      "confidence": 0.5,
      "relation": "related_to",
      "source": "arxiv:2607.14076v1",
      "target": "gpu_graphics"
    },
    {
      "confidence": 0.5,
      "relation": "related_to",
      "source": "arxiv:2607.14078v1",
      "target": "cognition"
    },
    {
      "confidence": 0.5,
      "relation": "related_to",
      "source": "arxiv:2607.14078v1",
      "target": "cognition_social"
    },
    {
      "confidence": 0.5,
      "relation": "related_to",
      "source": "arxiv:2607.14088v1",
      "target": "gpu_graphics"
    },
    {
      "confidence": 0.5,
      "relation": "related_to",
      "source": "arxiv:2607.15143v1",
      "target": "cognition"
    },
    {
      "confidence": 0.5,
      "relation": "related_to",
      "source": "arxiv:2607.15143v1",
      "target": "llm_agent"
    },
    {
      "confidence": 0.5,
      "relation": "related_to",
      "source": "arxiv:2607.15143v1",
      "target": "cognition_social"
    },
    {
      "confidence": 0.5,
      "relation": "related_to",
      "source": "arxiv:2607.15225v1",
      "target": "architecture"
    },
    {
      "confidence": 0.5,
      "relation": "related_to",
      "source": "arxiv:2607.15271v1",
      "target": "gpu_graphics"
    },
    {
      "confidence": 0.5,
      "relation": "related_to",
      "source": "arxiv:2607.15271v1",
      "target": "llm_agent"
    },
    {
      "confidence": 0.5,
      "relation": "related_to",
      "source": "arxiv:2607.15275v1",
      "target": "llm_agent"
    },
    {
      "confidence": 0.5,
      "relation": "related_to",
      "source": "arxiv:2607.15277v1",
      "target": "llm_agent"
    },
    {
      "confidence": 0.5,
      "relation": "related_to",
      "source": "arxiv:2607.15278v1",
      "target": "gpu_graphics"
    },
    {
      "confidence": 0.5,
      "relation": "related_to",
      "source": "arxiv:2607.15868v1",
      "target": "gpu_graphics"
    },
    {
      "confidence": 0.5,
      "relation": "related_to",
      "source": "arxiv:2607.15868v1",
      "target": "llm_agent"
    },
    {
      "confidence": 0.5,
      "relation": "related_to",
      "source": "arxiv:2607.15868v1",
      "target": "cognition"
    },
    {
      "confidence": 0.5,
      "relation": "related_to",
      "source": "arxiv:2607.15868v1",
      "target": "cognition_social"
    },
    {
      "confidence": 0.5,
      "relation": "related_to",
      "source": "arxiv:2607.16109v1",
      "target": "llm_agent"
    },
    {
      "confidence": 0.5,
      "relation": "related_to",
      "source": "arxiv:2607.16109v1",
      "target": "architecture"
    },
    {
      "confidence": 0.5,
      "relation": "related_to",
      "source": "arxiv:2607.16121v1",
      "target": "llm_agent"
    },
    {
      "confidence": 0.5,
      "relation": "related_to",
      "source": "arxiv:2607.16127v1",
      "target": "llm_agent"
    },
    {
      "confidence": 0.5,
      "relation": "related_to",
      "source": "arxiv:2607.16192v1",
      "target": "gpu_graphics"
    },
    {
      "confidence": 0.5,
      "relation": "related_to",
      "source": "arxiv:2607.16193v1",
      "target": "gpu_graphics"
    },
    {
      "confidence": 0.5,
      "relation": "related_to",
      "source": "arxiv:2607.17774v1",
      "target": "llm_agent"
    },
    {
      "confidence": 0.5,
      "relation": "related_to",
      "source": "arxiv:2607.17774v1",
      "target": "cognition"
    },
    {
      "confidence": 0.5,
      "relation": "related_to",
      "source": "arxiv:2607.17774v1",
      "target": "cognition_social"
    },
    {
      "confidence": 0.5,
      "relation": "related_to",
      "source": "arxiv:2607.18150v1",
      "target": "gpu_graphics"
    },
    {
      "confidence": 0.5,
      "relation": "related_to",
      "source": "arxiv:2607.18178v1",
      "target": "architecture"
    },
    {
      "confidence": 0.5,
      "relation": "related_to",
      "source": "arxiv:2607.18181v1",
      "target": "llm_agent"
    },
    {
      "confidence": 0.5,
      "relation": "related_to",
      "source": "arxiv:2607.18187v1",
      "target": "gpu_graphics"
    },
    {
      "confidence": 0.5,
      "relation": "related_to",
      "source": "arxiv:2607.18187v1",
      "target": "llm_agent"
    },
    {
      "confidence": 0.5,
      "relation": "related_to",
      "source": "arxiv:2607.18213v1",
      "target": "llm_agent"
    },
    {
      "confidence": 0.5,
      "relation": "related_to",
      "source": "arxiv:2607.19291v1",
      "target": "llm_agent"
    },
    {
      "confidence": 0.5,
      "relation": "related_to",
      "source": "arxiv:2607.19297v1",
      "target": "llm_agent"
    },
    {
      "confidence": 0.5,
      "relation": "related_to",
      "source": "arxiv:2607.19310v1",
      "target": "architecture"
    },
    {
      "confidence": 0.5,
      "relation": "related_to",
      "source": "arxiv:2607.19316v1",
      "target": "cognition"
    },
    {
      "confidence": 0.5,
      "relation": "related_to",
      "source": "arxiv:2607.19316v1",
      "target": "cognition_social"
    },
    {
      "confidence": 0.5,
      "relation": "related_to",
      "source": "arxiv:2607.19343v1",
      "target": "gpu_graphics"
    },
    {
      "confidence": 0.5,
      "relation": "related_to",
      "source": "arxiv:2607.19344v1",
      "target": "gpu_graphics"
    },
    {
      "confidence": 0.5,
      "relation": "related_to",
      "source": "arxiv:2607.19344v1",
      "target": "llm_agent"
    },
    {
      "confidence": 0.5,
      "relation": "related_to",
      "source": "arxiv:2607.20310v1",
      "target": "cognition"
    },
    {
      "confidence": 0.5,